<?xml version = "1.0" encoding = "utf-8"?>

<!-- !DOCTYPE konyvek SYSTEM "ND_konyv.dtd">-->
 
<konyvek xmlns:xs="http://www.w3.org/2001/XMLSchema-instance" xs:noNamespaceSchemaLocation="http://www.example.com/ND_konyv.xsd">
    <konyv id = "01">

        <cim> Programming Pearls </cim>
        <kiadasiEv> 2006.12.01 </kiadasiEv>
        <kiado> Dorling Kindersley Pvt Ltd </kiado>
        <szerzo> Jon Bentley </szerzo>
        <abstract> The book is about pearl programming. </abstract>


    </konyv>

    <konyv id = "02">

        <cim>  Introduction to Algorithms </cim>
        <kiadasiEv> 1990 </kiadasiEv>
        <kiado> MIT P-ress </kiado>
        <szerzo> Thomas H. Cormen </szerzo>
        <szerzo> Charles E. Leiserson</szerzo>
        <szerzo> Ronald L. Rivest </szerzo>
        <szerzo> Clifford Stein </szerzo>
		<abstract> The book is about basic algorithms.</abstract>
    </konyv>

    <konyv id = "03">

        <cim> HTML and CSS: Design and Build Websites </cim>
        <kiadasiEv>  2011. okt√≥ber 25. </kiadasiEv>
        <kiado> Wiley </kiado>
        <szerzo> Jon Duckett </szerzo>
        <abstract> The book is about web design.</abstract>


    </konyv>
 
</konyvek>